{
  "name": "automation-os",
  "displayName": "Automation OS",
  "version": "1.0.0",
  "description": "Control plane for the existing n8n instance: workflows, executions, health and integration status.",
  "entry": "app/(dashboard)/automation",
  "requiresEnv": ["N8N_BASE_URL"],
  "tables": ["IntegrationStatus"],
  "webhooks": [],
  "permissions": [
    { "action": "read", "resource": "automation" },
    { "action": "admin", "resource": "automation" }
  ],
  "audit": true,
  "actions": ["refreshIntegrationStatusAction"]
}
